4474,"As a application administrator, I want to mark a sessionAs accepted, so that I can populate the schedule ."
4475,"As a system admin, I want to mark a sessionAs accepted, so that I can populate the schedule ."
4476,"As a system administrator, I want to mark a sessionAs accepted, so that I can populate the schedule ."
4477,"As a sys admin, I want to mark a sessionAs accepted, so that I can populate the schedule ."
4478,"As a sys administrator, I want to mark a sessionAs accepted, so that I can populate the schedule ."
4479,"As a anyone, I want to receive a notification when sessions have been evaluated, so that I know whether I've been accepted or rejected."
4480,"As a anyone, I want to receive a notification when I submit a session, so that know that my session went through ok."
4481,"As a authenticateduser, I want to modify my session, so that if I make a mistake, I can correct it."
4482,"As a authenticateduser, I want to update my session, so that if I make a mistake, I can correct it."
4483,"As a anyone, I want to register to speak at BADCamp, so that I submit a session."
4484,"As a anyone, I want to see a list of all the summits that include when they are, so that I can determine which summit I want to attend."
4485,"As a anyone, I want to easily find a link in the menu that links to the registration form, so that I can easily register for the camp."
4486,"As a anyone, I want to fill out a user registration form, so that I can register for the camp and get an account on the website."
4487,"As a anonymoususer, I want to fill out a customer registration form, so that I can register for the camp and get an account on the website."
4488,"As a anonymoususer, I want to fill out a client registration form, so that I can register for the camp and get an account on the website."
4489,"As a anonymoususer, I want to fill out a end user registration form, so that I can register for the camp and get an account on the website."
4490,"As a anyone, I want to find session information, so that I can go to a session."
4491,"As a PI, I want to appropriately record all metadata, so that I can ensure proper running of the project in case of staff changes."
4492,"As a PI, I want to correctly record all metadata, so that I can ensure proper running of the project in case of staff changes."
4493,"As a PI, I want to accurately record all metadata, so that I can ensure proper running of the project in case of staff changes."
4494,"As a PI, I want to properly record all metadata, so that I can guarantee proper running of the project in case of staff changes."
4495,"As a PI, I want to properly record all metadata, so that I can emphasize proper running of the project in case of staff changes."
4496,"As a PI, I want to properly record all metadata, so that I can ensure proper running of the project in case of employee changes."
4497,"As a PI, I want to appropriately record all metadata, so that I can ensure proper running of the project in case of staff changes."
4498,"As a PI, I want to correctly record all metadata, so that I can ensure proper running of the project in case of staff changes."
4499,"As a PI, I want to accurately record all metadata, so that I can ensure proper running of the project in case of staff changes."
4500,"As a PI, I want to properly record all metadata, so that I can guarantee proper running of the project in case of staff changes."
4501,"As a PI, I want to properly record all metadata, so that I can emphasize proper running of the project in case of staff changes."
4502,"As a PI, I want to properly record all metadata, so that I can ensure proper running of the project in case of employee changes."
4503,"As a data director, I want to know how the data is used, so that I can develop more detailed usage and support scenarios with researchers."
4504,"As a data supervisor, I want to know how the data is used, so that I can develop more detailed usage and support scenarios with researchers."
4505,"As a data chief, I want to know how the data is used, so that I can develop more detailed usage and support scenarios with researchers."
4506,"As an IT director, I want to know about IT resource requirements early in the project lifecycle, so that I can enable resource acquisition planning."
4507,"As an IT supervisor, I want to know about IT resource requirements early in the project lifecycle, so that I can enable resource acquisition planning."
4508,"As an IT chief, I want to know about IT resource requirements early in the project lifecycle, so that I can enable resource acquisition planning."
4509,"As a PI, I want to plan what kind of data I want to record/store, so that I can guarantee it will possible to store it."
4510,"As a PI, I want to plan what kind of data I want to record/store, so that I can emphasize it will possible to store it."
4511,"As an IT employee member, I want to know the security requirements of the data, so that I know which kind of security measures to apply."
4512,"As a data director, I want to have the description of collected data sets that are used or updated throughout the project lifecycle, so that I can ensure the descriptions are current and add detailAs the study proceeds."
4513,"As a data supervisor, I want to have the description of collected data sets that are used or updated throughout the project lifecycle, so that I can ensure the descriptions are current and add detailAs the study proceeds."
4514,"As a data chief, I want to have the description of collected data sets that are used or updated throughout the project lifecycle, so that I can ensure the descriptions are current and add detailAs the study proceeds."
4515,"As a data manager, I want to have the description of collected data sets that are used or updated throughout the project lifecycle, so that I can guarantee the descriptions are current and add detailAs the study proceeds."
4516,"As a data manager, I want to have the description of collected data sets that are used or updated throughout the project lifecycle, so that I can emphasize the descriptions are current and add detailAs the study proceeds."
4517,"As a researcher, I want to know which topics are mandatory and similar in all DMPs, so that I can save time through immediately writing it."
4518,"As a researcher, I want to know which topics are mandatory and similar in all DMPs, so that I can save time through rapidly writing it."
4519,"As a researcher, I want to know which topics are mandatory and similar in all DMPs, so that I can save time through instantly writing it."
4520,"As a data director, I want to know what the content of the data is, so that I can decide to which collection or repository the data fits."
4521,"As a data supervisor, I want to know what the content of the data is, so that I can decide to which collection or repository the data fits."
4522,"As a data chief, I want to know what the content of the data is, so that I can decide to which collection or repository the data fits."
4523,"As a data manager, I want to know what the content of the data is, so that I can decide to which group or repository the data fits."
4524,"As a data manager, I want to know what the content of the data is, so that I can decide to which set or repository the data fits."
4525,"As an IT employee member, I want to have an estimate of the produced data volume, so that I can plan the overall storage consumption."
4526,"As an admin, I want to know who funded the project and their requirements, so that I can track the funder specific obligations."
4527,"As an application administrator, I want to know who funded the project and their requirements, so that I can track the funder specific obligations."
4528,"As an system admin, I want to know who funded the project and their requirements, so that I can track the funder specific obligations."
4529,"As an system administrator, I want to know who funded the project and their requirements, so that I can track the funder specific obligations."
4530,"As an sys admin, I want to know who funded the project and their requirements, so that I can track the funder specific obligations."
4531,"As an sys administrator, I want to know who funded the project and their requirements, so that I can track the funder specific obligations."
4532,"As a data director, I want to know which kind of data types will be produced or collected, so that I can determine what basic support services and functionalities are required."
4533,"As a data supervisor, I want to know which kind of data types will be produced or collected, so that I can determine what basic support services and functionalities are required."
4534,"As a data chief, I want to know which kind of data types will be produced or collected, so that I can determine what basic support services and functionalities are required."
4535,"As an IT employee member, I want to know which kind of data types will be produced or collected, so that I can determine what basic support services and functionalities are required."
4536,"As an archivemanager, I want to know in advance the conservation period of data, so that I can best organize the service by adapting the preservation actions."
4537,"As a data director, I want to document all rights necessary for managing the data, so that I can curate and preserve the data."
4538,"As a data supervisor, I want to document all rights necessary for managing the data, so that I can curate and preserve the data."
4539,"As a data chief, I want to document all rights necessary for managing the data, so that I can curate and preserve the data."
4540,"As a data director, I want to know what the content of the data is, so that I can check whether the necessary expertise for maintaining intellectual reusability is available."
4541,"As a data supervisor, I want to know what the content of the data is, so that I can check whether the necessary expertise for maintaining intellectual reusability is available."
4542,"As a data chief, I want to know what the content of the data is, so that I can check whether the necessary expertise for maintaining intellectual reusability is available."
4543,"As a metadata director, I want to have a short description of project, so that I can be informed about the metadata description."
4544,"As a metadata supervisor, I want to have a short description of project, so that I can be informed about the metadata description."
4545,"As a metadata chief, I want to have a short description of project, so that I can be informed about the metadata description."
4546,"As a data director, I want to know the time plan for collecting data, so that I can plan the data management."
4547,"As a data supervisor, I want to know the time plan for collecting data, so that I can plan the data management."
4548,"As a data chief, I want to know the time plan for collecting data, so that I can plan the data management."
4549,"As a director, I want to know about all resources and services used for the data, so that I can estimate the true cost of the project."
4550,"As a supervisor, I want to know about all resources and services used for the data, so that I can estimate the true cost of the project."
4551,"As a chief, I want to know about all resources and services used for the data, so that I can estimate the true cost of the project."
4552,"As an ethics director, I want to be informed about the data, so that I can check for sensitivity of data."
4553,"As an ethics supervisor, I want to be informed about the data, so that I can check for sensitivity of data."
4554,"As an ethics chief, I want to be informed about the data, so that I can check for sensitivity of data."
4555,"As a repository director, I need details on the type of data, so that I can check if the archiving can be arranged."
4556,"As a repository supervisor, I need details on the type of data, so that I can check if the archiving can be arranged."
4557,"As a repository chief, I need details on the type of data, so that I can check if the archiving can be arranged."
4558,"As an IT officer, I want to know how secure data is, so that I can guarantee legal compliance."
4559,"As an IT officer, I want to know how secure data is, so that I can emphasize legal compliance."
4560,"As a funder, I want to know how secure data is, so that I can guarantee legal compliance."
4561,"As a funder, I want to know how secure data is, so that I can emphasize legal compliance."
4562,"As a Research Centre manager, I want to receive regular summary reports of research data, so that I understand trends in data use among staff and postgraduate students."
4563,"As a Research Centre supervisor, I want to receive regular summary reports of research data, so that I understand trends in data use among staff and postgraduate students."
4564,"As a Research Centre chief, I want to receive regular summary reports of research data, so that I understand trends in data use among staff and postgraduate students."
4565,"As a Research Centre Director, I want to receive regular summary reports of research data, so that I understand trends in data use among employee and postgraduate students."
4566,"As a Postgraduate Convenor, I want to receive regular summary reports of research data, so that I understand trends in data use among employee and postgraduate students."
4567,"As a research support officer, I want to guarantee compliance to the funders rules, so that I can ensure all costs will be accepted."
4568,"As a research support officer, I want to emphasize compliance to the funders rules, so that I can ensure all costs will be accepted."
4569,"As a research support officer, I want to ensure compliance to the funders rules, so that I can guarantee all costs will be accepted."
4570,"As a research support officer, I want to ensure compliance to the funders rules, so that I can emphasize all costs will be accepted."
4571,"As a PI, I want to plan what kind of data I want to store, so that I can guarantee it will be possible to store it."
4572,"As a PI, I want to plan what kind of data I want to store, so that I can emphasize it will be possible to store it."
4573,"As a PI, I want to know how secure data is, so that I can guarantee legal compliance."
4574,"As a PI, I want to know how secure data is, so that I can emphasize legal compliance."
4575,"As a manager of Research Integrity, I want to access reports containing details of research projects in which data are classifiedAs sensitive or highly sensitive, so that I can confirm security protocols are applied to these data."
4576,"As a supervisor of Research Integrity, I want to access reports containing details of research projects in which data are classifiedAs sensitive or highly sensitive, so that I can confirm security protocols are applied to these data."
4577,"As a chief of Research Integrity, I want to access reports containing details of research projects in which data are classifiedAs sensitive or highly sensitive, so that I can confirm security protocols are applied to these data."
4578,"As a data director, I want to have references to documentation of the data and its creation process, so that the data can be re-used and managed."
4579,"As a data supervisor, I want to have references to documentation of the data and its creation process, so that the data can be re-used and managed."
4580,"As a data chief, I want to have references to documentation of the data and its creation process, so that the data can be re-used and managed."
4581,"As a data director, I want to know which kind of data types will be produced or collected, so that I can ensure that the necessary technical resources and technical know-how is available."
4582,"As a data supervisor, I want to know which kind of data types will be produced or collected, so that I can ensure that the necessary technical resources and technical know-how is available."
4583,"As a data chief, I want to know which kind of data types will be produced or collected, so that I can ensure that the necessary technical resources and technical know-how is available."
4584,"As a data manager, I want to know which kind of data types will be produced or collected, so that I can guarantee that the necessary technical resources and technical know-how is available."
4585,"As a data manager, I want to know which kind of data types will be produced or collected, so that I can emphasize that the necessary technical resources and technical know-how is available."
4586,"As an IT employee member, I want to know which kind of data types will be produced or collected, so that I can ensure that the necessary technical resources and technical know-how is available."
4587,"As an IT staff member, I want to know which kind of data types will be produced or collected, so that I can guarantee that the necessary technical resources and technical know-how is available."
4588,"As an IT staff member, I want to know which kind of data types will be produced or collected, so that I can emphasize that the necessary technical resources and technical know-how is available."
4589,"As an IT employee member, I want to know how the data is used, so that I can determine what kind of basic services and functionalities are required."
4590,"As a data director, I want to know whether the collected data depends on other data sets from my own or other institutions, so that I can ensure that these dependencies are maintained."
4591,"As a data supervisor, I want to know whether the collected data depends on other data sets from my own or other institutions, so that I can ensure that these dependencies are maintained."
4592,"As a data chief, I want to know whether the collected data depends on other data sets from my own or other institutions, so that I can ensure that these dependencies are maintained."
4593,"As a data manager, I want to know whether the collected data depends on other data sets from my own or other institutions, so that I can guarantee that these dependencies are maintained."
4594,"As a data manager, I want to know whether the collected data depends on other data sets from my own or other institutions, so that I can emphasize that these dependencies are maintained."
4595,"As an IT employee member, I want to know which formats are used, so that I can determine what kind of technical services and functionalities are required."
4596,"As an IT employee member, I want to know with which software or technology the data is produced or used, so that I can determine what kind of technical services and functionalities are required."
4597,"As a data director, I want to know which information is necessary to re-use the data, so that it can be checked whether all necessary information is available for researchers interested in re-using the data."
4598,"As a data supervisor, I want to know which information is necessary to re-use the data, so that it can be checked whether all necessary information is available for researchers interested in re-using the data."
4599,"As a data chief, I want to know which information is necessary to re-use the data, so that it can be checked whether all necessary information is available for researchers interested in re-using the data."
4600,"As a data director, I want to know which formats are used, so that I know what technology or background information might be necessary to use the data."
4601,"As a data supervisor, I want to know which formats are used, so that I know what technology or background information might be necessary to use the data."
4602,"As a data chief, I want to know which formats are used, so that I know what technology or background information might be necessary to use the data."
4603,"As a data director, I want to know whether the data can be reproduced efficiently, so that I can determine whether and how the data has to be stored."
4604,"As a data supervisor, I want to know whether the data can be reproduced efficiently, so that I can determine whether and how the data has to be stored."
4605,"As a data chief, I want to know whether the data can be reproduced efficiently, so that I can determine whether and how the data has to be stored."
4606,"As a data manager, I want to know whether the data can be reproduced effectively, so that I can determine whether and how the data has to be stored."
4607,"As a data manager, I want to know whether the data can be reproduced productively, so that I can determine whether and how the data has to be stored."
4608,"As a data director, I want to know with which software or technology the data is produced or used, so that I know what technology or background information might be necessary to (re-)use the data."
4609,"As a data supervisor, I want to know with which software or technology the data is produced or used, so that I know what technology or background information might be necessary to (re-)use the data."
4610,"As a data chief, I want to know with which software or technology the data is produced or used, so that I know what technology or background information might be necessary to (re-)use the data."
4611,"As a research evaluation director, I want to ensure all data are quoted correctly with our affiliation, so that they are counted towards our citation counts."
4612,"As a research evaluation supervisor, I want to ensure all data are quoted correctly with our affiliation, so that they are counted towards our citation counts."
4613,"As a research evaluation chief, I want to ensure all data are quoted correctly with our affiliation, so that they are counted towards our citation counts."
4614,"As a research evaluation manager, I want to guarantee all data are quoted correctly with our affiliation, so that they are counted towards our citation counts."
4615,"As a research evaluation manager, I want to emphasize all data are quoted correctly with our affiliation, so that they are counted towards our citation counts."
4616,"As a research evaluation manager, I want to ensure all data are quoted appropriately with our affiliation, so that they are counted towards our citation counts."
4617,"As a research evaluation manager, I want to ensure all data are quoted accurately with our affiliation, so that they are counted towards our citation counts."
4618,"As a research evaluation manager, I want to ensure all data are quoted properly with our affiliation, so that they are counted towards our citation counts."
4619,"As an admin, I want to check that all data has the appropriate security level, so that I can demonstrate compliance."
4620,"As an application administrator, I want to check that all data has the appropriate security level, so that I can demonstrate compliance."
4621,"As an system admin, I want to check that all data has the appropriate security level, so that I can demonstrate compliance."
4622,"As an system administrator, I want to check that all data has the appropriate security level, so that I can demonstrate compliance."
4623,"As an sys admin, I want to check that all data has the appropriate security level, so that I can demonstrate compliance."
4624,"As an sys administrator, I want to check that all data has the appropriate security level, so that I can demonstrate compliance."
4625,"As a data director, I want to know the security requirements of the data, so that I can check whether the data can be kept secure."
4626,"As a data supervisor, I want to know the security requirements of the data, so that I can check whether the data can be kept secure."
4627,"As a data chief, I want to know the security requirements of the data, so that I can check whether the data can be kept secure."
4628,"As an institutional data director, I want to know about the privacy and security requirements of the data, so that I can plan the right storage system and sharing permissions."
4629,"As an institutional data supervisor, I want to know about the privacy and security requirements of the data, so that I can plan the right storage system and sharing permissions."
4630,"As an institutional data chief, I want to know about the privacy and security requirements of the data, so that I can plan the right storage system and sharing permissions."
4631,"As a researcher, I want to see the sections on costing by other researchers in my department, so that I can see if we could share data director posts."
4632,"As a researcher, I want to see the sections on costing by other researchers in my department, so that I can see if we could share data supervisor posts."
4633,"As a researcher, I want to see the sections on costing by other researchers in my department, so that I can see if we could share data chief posts."
4634,"As a researcher, I want to see the sections on roles submitted by other researchers in my department, so that I can see if we could share data director posts."
4635,"As a researcher, I want to see the sections on roles submitted by other researchers in my department, so that I can see if we could share data supervisor posts."
4636,"As a researcher, I want to see the sections on roles submitted by other researchers in my department, so that I can see if we could share data chief posts."
4637,"As a researcher, I want to see the sections on responsibilities submitted by other researchers in my department, so that I can see if we could share data director posts."
4638,"As a researcher, I want to see the sections on responsibilities submitted by other researchers in my department, so that I can see if we could share data supervisor posts."
4639,"As a researcher, I want to see the sections on responsibilities submitted by other researchers in my department, so that I can see if we could share data chief posts."
4640,"As a faculty data steward, I want to see the sections on costing, so that I can guarantee sufficient expertise on data management to support the project."
